{
  "schema_version": 1,
  "event_id": "018ff000-0000-7000-8000-000000000001",
  "tenant_id": "demo",
  "occurred_at": "2026-10-10T11:59:00Z",
  "received_at": "2026-10-10T11:59:01Z",
  "source": "generator",
  "event_type": "auth.failure",
  "source_ip": "192.0.2.10",
  "destination_ip": "198.51.100.20",
  "destination_port": 443,
  "protocol": "tcp",
  "principal": "example-user",
  "action": "deny",
  "outcome": "failure",
  "attributes": {
    "k0": 0,
    "k1": 1,
    "k2": 2,
    "k3": 3,
    "k4": 4,
    "k5": 5,
    "k6": 6,
    "k7": 7,
    "k8": 8,
    "k9": 9,
    "k10": 10,
    "k11": 11,
    "k12": 12,
    "k13": 13,
    "k14": 14,
    "k15": 15,
    "k16": 16,
    "k17": 17,
    "k18": 18,
    "k19": 19,
    "k20": 20,
    "k21": 21,
    "k22": 22,
    "k23": 23,
    "k24": 24,
    "k25": 25,
    "k26": 26,
    "k27": 27,
    "k28": 28,
    "k29": 29,
    "k30": 30,
    "k31": 31
  }
}
